{
  "allow_insecure_local_http": false,
  "base_url": "https://api.openai.com/v1",
  "capabilities": {
    "model_listing": false,
    "stream_usage": false,
    "streaming": true,
    "timestamps": false,
    "token_counting": false
  },
  "context_limit_tokens": 128000,
  "credential_ref": {
    "account": "B96D5633-E3DA-4C84-A55A-66C436933A82",
    "origin": "https://api.openai.com",
    "store": "keychain"
  },
  "display_name": "OpenAI",
  "max_output_tokens": 4000,
  "model": "model-entered-by-user",
  "provider_id": "8F370106-0A7A-4DFC-920C-2B2A99352AFA",
  "provider_kind": "openai_responses",
  "schema_version": 1
}
