{
  "allow_insecure_local_http": true,
  "base_url": "http://192.168.1.20:1234/v1",
  "capabilities": {
    "model_listing": false,
    "stream_usage": true,
    "streaming": true,
    "timestamps": false,
    "token_counting": false
  },
  "context_limit_tokens": 32768,
  "display_name": "Studio Mac",
  "model": "local-model",
  "provider_id": "F3036092-BD98-4699-8AC1-1155F23BC976",
  "provider_kind": "openai_compatible_chat",
  "schema_version": 1
}
